{
  "$schema": "https://json-schema.org/draft/2020-12/schema",
  "$id": "urn:main-protocol:schema:weight-challenge-evidence:v1",
  "title": "Main Protocol Weight Challenge Evidence v1",
  "type": "object",
  "additionalProperties": false,
  "required": [
    "schema",
    "datasetId",
    "chainId",
    "datasetRegistry",
    "weightsRoot",
    "challenger",
    "submittedAt",
    "reason",
    "summary",
    "artifacts"
  ],
  "properties": {
    "schema": { "const": "main-protocol.weight-challenge-evidence.v1" },
    "datasetId": { "type": "string", "pattern": "^[1-9][0-9]*$" },
    "chainId": { "type": "string", "pattern": "^[1-9][0-9]*$" },
    "datasetRegistry": { "type": "string", "pattern": "^0x[0-9a-fA-F]{40}$" },
    "weightsRoot": { "type": "string", "pattern": "^0x[0-9a-fA-F]{64}$" },
    "challenger": { "type": "string", "pattern": "^0x[0-9a-fA-F]{40}$" },
    "submittedAt": { "type": "string", "format": "date-time" },
    "reason": {
      "enum": [
        "duplicate-address",
        "invalid-weight",
        "wrong-total-weight",
        "wrong-attribution",
        "root-mismatch",
        "manifest-unavailable",
        "other"
      ]
    },
    "summary": { "type": "string", "minLength": 1 },
    "artifacts": {
      "type": "array",
      "minItems": 1,
      "items": {
        "type": "object",
        "additionalProperties": false,
        "required": ["uri", "digest"],
        "properties": {
          "uri": { "type": "string", "minLength": 1 },
          "digest": { "type": "string", "pattern": "^0x[0-9a-fA-F]{64}$" }
        }
      }
    }
  }
}
